{"assignment":{"completion_criteria":["Record a supported adoption/defer/reject decision for each supplied finding."],"scope":"synthetic sample: compare two fictional raw findings and document a reusable test-plan lesson."},"attempt":1,"document_type":"knowledge_input","knowledge_references":[{"applicability":"synthetic sample: test-plan reviews for string fields requiring a non-whitespace character.","exceptions":["synthetic sample: Unicode/runtime behavior requires separate verification."],"id":"SYNTHETIC-ARTICLE-1","lifecycle":"draft","locator":"article.md","review_trigger":"synthetic sample: re-evaluate before using a different runtime or promoting to active.","revision":"sha256:4252b7f4d71cede5e78b9e540b0e9440c4cdaa6e36ca5afdc9374f4978e3fb72","sources":[{"locator":"source-1.md","revision":"sha256:63e7f46bea8e25dddc6016e99a5234895f58b6f25c6fe3a8fc9981117d3cce3f"},{"locator":"source-2.md","revision":"sha256:7455b6565f9ac4801a6aa19dc5923c81889f743e76d7a001b237c73fe5717b39"}]}],"permissions":["synthetic sample: read supplied findings and write Knowledge artifacts only."],"publication":"synthetic_sample","raw_findings":[{"domain":"validation","id":"a5b7e21e9919d42d8a88f4b246274162ed046d2746f0d36528765c82c1d6c628","issue_refs":[{"id":"SYNTHETIC-ISSUE-1","source":"https://example.invalid/synthetic/issues/1"}],"observation":"synthetic sample: fictional design 1 separates an empty-string case from a whitespace-only case.","sources":[{"locator":"source-1.md","revision":"sha256:63e7f46bea8e25dddc6016e99a5234895f58b6f25c6fe3a8fc9981117d3cce3f"}]},{"domain":"validation","id":"97c9bbd57d6cf8ad3c308a3c30281ce21a0c2494d6e607263a8e3ac05e7ca7c7","issue_refs":[{"id":"SYNTHETIC-ISSUE-2","source":"https://example.invalid/synthetic/issues/2"}],"observation":"synthetic sample: fictional design 2 separates an empty-string case from a whitespace-only case.","sources":[{"locator":"source-2.md","revision":"sha256:7455b6565f9ac4801a6aa19dc5923c81889f743e76d7a001b237c73fe5717b39"}]}],"retry_of":[],"role":"knowledge","schema_version":"1.0","task_id":"SYNTHETIC-KNOWLEDGE-TASK-1"}
